{
  "claimPeriodStartDate": "2017-12-06",
  "claimPeriodEndDate": "2018-01-05",
  "withdrawalAmount": 2000.00,
  "withdrawalChargeAmount": 500.00,
  "withdrawalChargeAmountYTD": 750.00,
  "fundsDeductedDuringWithdrawal": true,
  "withdrawalReason": "Superseded withdrawal",
  "automaticRecoveryAmount": 250.00,
  "supersede": {
    "originalTransactionId": "2345678901",
    "originalWithdrawalChargeAmount": 250.00,
    "transactionResult": 250.00,
    "reason": "Additional withdrawal"
  }
}